filepath,call_number,photographer,caption,year,month,state,city,county,longitude,latitude
media/fsac/1a35266v.jpg,LC-DIG-fsac-1a35266,Alfred T. Palmer,"Eight generator units in the generator room of a new addition to TVA&#39;s hydroelectric plant at Wilson Dam, Sheffield vicinity, Ala. Located 260 miles above the mouth of the Tennessee River, the dam has an authorized power installation of 288,000 kw., which can be increased to a possible ultimate of 444,000 kw. The reservoir at the dam adds 377,000 acre-feet of water to controlled storage on the Tennessee River system",1942,6,Alabama,Sheffield,Colbert County,-87.6986407,34.7650887
media/fsac/1a34940v.jpg,LC-DIG-fsac-1a34940,Howard R. Hollem,"Metal tubing at the Consolidated Aircraft Corp. plant, Fort Worth, Texas",1942,10,Texas,Fort Worth,Tarrant County,-97.3208496,32.725409
media/fsac/1a34143v.jpg,LC-DIG-fsac-1a34143,Russell Lee,"The school at Pie Town, New Mexico is held in the Farm Bureau building, which was constructed by cooperative effort",1940,10,New Mexico,Pie Town,Catron County,-108.1347836,34.2983884
media/fsac/1a35375v.jpg,LC-DIG-fsac-1a35375,Alfred T. Palmer,"Drilling horizontal stabilizers: operating a hand drill, this woman worker at Vultee-Nashville is shown working on the horizontal stabilizer for a Vultee &quot;Vengeance&quot; dive bomber, Tennessee. The &quot;Vengeance&quot; (A-31) was originally designed for the French. It was later adopted by the R.A.F. and still later by the U.S. Army Air Forces. It is a single-engine, low-wing plane, carrying a crew of two men and having six machine guns of varying calibers",1943,2,Tennessee,Nashville,Davidson County,-86.7844432,36.1658899
media/fsac/1a34758v.jpg,LC-DIG-fsac-1a34758,Jack Delano,"Santa Fe R.R. trains going through Cajon Pass in the San Bernardino Mountains, Cajon, Calif. On the right, streamliner &quot;Chief&quot; going west; in the background, on the left, a freight train with a helper engine, going east. Santa Fe trip",1943,3,California,Cajon,San County,-116.9625269,32.7947731
media/fsac/1a34718v.jpg,LC-DIG-fsac-1a34718,Jack Delano,"General view of the city and the Atchison, Topeka, and Santa Fe Railroad, Amarillo, Texas. Santa Fe R.R. trip",1943,3,Texas,Amarillo,Potter County,-101.8312969,35.2219971
media/fsac/1a34400v.jpg,LC-DIG-fsac-1a34400,Marion Post Wolcott,"Houses which have been condemned by the Board of Health but are still occupied by Negro migratory workers, Belle Glade, Fla.",1941,1,Florida,Belle Glade,Palm Beach,-80.6675577,26.6845104
media/fsac/1a34371v.jpg,LC-DIG-fsac-1a34371,Marion Post Wolcott,"Burley tobacco is placed on sticks to wilt after cutting, before it is taken into the barn for drying and curing on the Russell Spears&#39; farm, vicinity of Lexington, Ky.",1940,9,Kentucky,Lexington,Fayette County,-84.4777153,37.9886892
media/fsac/1a34230v.jpg,LC-DIG-fsac-1a34230,Russell Lee,"Shasta dam under construction, California",1942,6,California,Redding,Shasta County,-122.3916754,40.5865396
media/fsac/1a34505v.jpg,LC-DIG-fsac-1a34505,John Collier,"Trampas, New Mexico",1943,1,New Mexico,Trampas,Taos County,-105.7589053,36.1311359
media/fsac/1a34850v.jpg,LC-DIG-fsac-1a34850,Andreas Feininger,"Constructing a building on the site of a new steel mill which will soon turn out steel for the war needs, Columbia Steel Co., Geneva, Utah",1942,11,Utah,Geneva,Utah County,-111.7321503,40.2824529
media/fsac/1a34378v.jpg,LC-DIG-fsac-1a34378,Marion Post Wolcott,"Farmers and townspeople in the center of town on Court Day, Campton, Ky.",1940,9,Kentucky,Campton,Wolfe County,-83.547409,37.7342526
media/fsac/1a35316v.jpg,LC-DIG-fsac-1a35316,Alfred T. Palmer,"Member[s] of the experimental staff at the North American Aviation, Inc., plant, observe wind tunnel tests on an accurate scale model of the B-25 (&quot;Billy Mitchell&quot;) bomber, Inglewood, Calif. This plant produces the battle-tested B-25 bomber, used in General Doolittle&#39;s raid on Tokyo, and the P-51 Mustang fighter plane which was first brought into prominence by the British raid on Dieppe",1942,10,California,Inglewood,Los County,-118.3531311,33.9616801
media/fsac/1a35415v.jpg,LC-DIG-fsac-1a35415,Arthur Siegel,"Hanna furnaces of the Great Lakes Steel Corporation, Detroit, Mich. Coal tower atop coke ovens",1942,11,Michigan,Detroit,Wayne County,-83.0457538,42.331427
media/fsac/1a34741v.jpg,LC-DIG-fsac-1a34741,Jack Delano,"Indian houses and farms on the Laguna Indian reservation, Laguna N[ew] Mex[ico]. In the background is Mount Taylor. The Santa Fe R.R. crosses the reservation",1943,3,New Mexico,Laguna,Cibola County,-107.3828231,35.0367105
media/fsac/1a34549v.jpg,LC-DIG-fsac-1a34549,John Collier,"Civil Air Patrol Base, Bar Harbor, Maine",1943,6,Maine,Bar Harbor (Town),Hancock County,-68.2594596,44.3748015
media/fsac/1a35095v.jpg,LC-DIG-fsac-1a35095,Alfred T. Palmer,Hitler would like this man to go home and forget about the war. A good American non-com at the side machine gun of a huge YB-17 bomber is a man who knows his business and works hard at it,1942,5,Virginia,Hampton,City Hampton,-76.3452218,37.0298687
media/fsac/1a35278v.jpg,LC-DIG-fsac-1a35278,Alfred T. Palmer,"A large electric phosphate smelting furnace used to make elemental phosphorus in a TVA chemical plant in the vicinity of Muscle Shoals, Ala.",1942,6,Alabama,Muscle Shoals,Colbert County,-87.6675292,34.7448112
media/fsac/1a34840v.jpg,LC-DIG-fsac-1a34840,Jack Delano,"Pennsylvania R.R. ore docks, unloading ore from a lake freighter by means of &quot;Hulett&quot; unloaders, Cleveland, Ohio",1943,5,Ohio,Cleveland,Cuyahoga County,-81.6954088,41.4994954
media/fsac/1a34987v.jpg,LC-DIG-fsac-1a34987,Howard R. Hollem,"The Governor&#39;s Palace, Williamsburg, Va. The capitol of the Virginia colony during the 18th century which was reconstructed and restored to its original state by John D. Rockefeller, Jr., during the 1930s",1943,4,Virginia,Williamsburg,City Williamsburg,-76.7074571,37.2707022
media/fsac/1a33862v.jpg,LC-DIG-fsac-1a33862,Jack Delano,"[Douglas Shoe Factory, Spark St., Brockton, Mass.]",1940,12,Massachusetts,Brockton,Plymouth County,-71.0183787,42.0834335
media/fsac/1a34118v.jpg,LC-DIG-fsac-1a34118,Russell Lee,"Les Thomas, homesteader, Pie Town, New Mexico",1940,10,New Mexico,Pie Town,Catron County,-108.1347836,34.2983884
media/fsac/1a35002v.jpg,LC-DIG-fsac-1a35002,Fenno Jacobs,"An American town and its way of life, Southington, Conn. The Memorial Day parade moving down the main street. The small number of spectators is accounted for by the fact that the town&#39;s war factories did not close. The town hall is in the left foreground. May 23 to May 30",1942,5,Connecticut,Southington,Hartford County,-72.8776013,41.5964869
media/fsac/1a35321v.jpg,LC-DIG-fsac-1a35321,Alfred T. Palmer,"Bomb bay gasoline tanks for long flights of B-25 bombers await assembly in the plant of North American Aviation, Inc., Inglewood, Calif. This plant produces the battle-tested B-25 (&quot;Billy Mitchell&quot;) bomber used in General Doolittle&#39;s raid on Tokyo, and the P-51 (&quot;Mustang&quot;) fighter plane which was first brought into prominence by the British raid on Dieppe",1942,10,California,Inglewood,Los County,-118.3531311,33.9616801
media/fsac/1a34732v.jpg,LC-DIG-fsac-1a34732,Jack Delano,"West bound Santa Fe R.R. freight train waiting in a siding to meet an east bound train, Ricardo, N[ew] Mex[ico]",1943,3,New Mexico,Ricardo,De County,-104.3852546,34.3906257
media/fsac/1a34938v.jpg,LC-DIG-fsac-1a34938,Howard R. Hollem,"Beulah Faith, 20, used to be sales clerk in department store, reaming tools for transport on lathe machine, Consolidated Aircraft Corp., Fort Worth, Texas",1942,10,Texas,Fort Worth,Tarrant County,-97.3208496,32.725409
media/fsac/1a35211v.jpg,LC-DIG-fsac-1a35211,Alfred T. Palmer,"Infantryman with halftrack, a young soldier of the armed forces, holds and sights his Garand rifle like an old timer, Fort Knox, Ky. He likes the piece for its fine firing qualities and its rugged, dependable mechanism.",1942,6,Kentucky,Fort Knox,Hardin County,-85.963629,37.891129
media/fsac/1a35434v.jpg,LC-DIG-fsac-1a35424,John Vachon,"Loading sulphur from vat, Freeport Sulphur Co., Hoskins Mound, Texas",1943,5,Texas,Freeport,Brazoria County,-95.3596617,28.9541368
media/fsac/1a34625v.jpg,LC-DIG-fsac-1a34625,Jack Delano,"General view of a classification yard at C &amp; NW RR&#39;s Proviso yard, Chicago, Ill.",1942,12,Illinois,Melrose Park,Cook County,-87.8567277,41.9005865
media/fsac/1a34857v.jpg,LC-DIG-fsac-1a34857,Andreas Feininger,"[Main Street, Creede, Colorado]",1942,12,Colorado,Creede,Mineral County,-106.9264345,37.8491662
media/fsac/1a35405v.jpg,LC-DIG-fsac-1a35405,Arthur Siegel,"Flag, Detroit, Mich.",1942,7,Michigan,Detroit,Wayne County,-83.0457538,42.331427
media/fsac/1a35210v.jpg,LC-DIG-fsac-1a35210,Alfred T. Palmer,"M-4 tank crews of the United States, Ft. Knox, Ky.",1942,6,Kentucky,Fort Knox,Hardin County,-85.963629,37.891129
media/fsac/1a35292v.jpg,LC-DIG-fsac-1a35292,Alfred T. Palmer,"Another North American B-25 bomber rolls off the final assembly line to join other ships on the outdoor assembly line, North American Aviation, Inc., Inglewood, Calif.",1942,10,California,Inglewood,Los County,-118.3531311,33.9616801
media/fsac/1a35376v.jpg,LC-DIG-fsac-1a35376,Alfred T. Palmer,"Two women workers are shown capping and inspecting tubing which goes into the manufacture of the &quot;Vengeance&quot; (A-31) dive bomber made at Vultee&#39;s Nashville division, Tennessee. The &quot;Vengeance&quot; (A-31) was originally designed for the French. It was later adopted by the R.A.F. and still later by the U.S. Army Air Forces. It is a single-engine, low-wing plane, carrying a crew of two men and having six machine guns of varying calibers",1943,2,Tennessee,Nashville,Davidson County,-86.7844432,36.1658899
media/fsac/1a34545v.jpg,LC-DIG-fsac-1a34545,John Collier,"Civil Air Patrol Base, Bar Harbor, Maine",1943,6,Maine,Bar Harbor (Town),Hancock County,-68.2594596,44.3748015
media/fsac/1a35431v.jpg,LC-DIG-fsac-1a35431,John Vachon,"Southland Paper Co., Kraft pulp mill under construction, Lufkin, Texas",1943,4,Texas,Lufkin,Angelina County,-94.729097,31.3382406
media/fsac/1a34803v.jpg,LC-DIG-fsac-1a34803,Jack Delano,"C. &amp; N.W. R.R., Mrs. Elibia Siematter, working as a sweeper at the roundhouse, Clinton, Iowa",1943,4,Iowa,Clinton,Clinton County,-90.1887379,41.8444735
media/fsac/1a34666v.jpg,LC-DIG-fsac-1a34666,Jack Delano,"Tracks leading into the freight house at Proviso yard. This is said to be the largest covered freight house in the world. C&amp;NWRR, Chicago, Ill.",1943,4,Illinois,Melrose Park,Cook County,-87.8567277,41.9005865
media/fsac/1a34124v.jpg,LC-DIG-fsac-1a34124,Russell Lee,"Pinto bean warehouse, Pie Town, New Mexico",1940,10,New Mexico,Pie Town,Catron County,-108.1347836,34.2983884
media/fsac/1a34647v.jpg,LC-DIG-fsac-1a34647,Jack Delano,"General view of a classification yard at C &amp; NW RR&#39;s Proviso (?) yard, Chicago, Ill.",1942,12,Illinois,Melrose Park,Cook County,-87.8567277,41.9005865
media/fsac/1a35369v.jpg,LC-DIG-fsac-1a35369,Alfred T. Palmer,"This woman worker at the Vultee-Nashville is shown making final adjustments in the wheel well of an inner wing before the installation of the landing gear, Nashville, Tenn. This [is] one of the numerous assembly operations in connection with the mass production of Vultee &quot;Vengeance&quot; dive bombers",1943,2,Tennessee,Nashville,Davidson County,-86.7844432,36.1658899
media/fsac/1a34781v.jpg,LC-DIG-fsac-1a34781,Jack Delano,"General view of part of the South Water Street freight depot of the Illinois Central Railroad, Chicago, Ill.",1943,4,Illinois,Chicago,Cook County,-87.6500523,41.850033
media/fsac/1a34754v.jpg,LC-DIG-fsac-1a34754,Jack Delano,"A east bound Union Pacific railroad freight train waiting in a siding, Alray, Calif. Coming up through Cajon Pass. The Santa Fe tracks are used by the Union Pacific as far east as Daggett, Calif. Santa Fe R.R. trip",1943,3,California,Alray,San County,-117.4828278,34.328336
media/fsac/1a34805v.jpg,LC-DIG-fsac-1a34805,Jack Delano,"C. &amp; N.W. R.R., women wipers employed at the roundhouse cleaning one of the giant &quot;H&quot; class locomotives, Clinton, Iowa",1943,4,Iowa,Clinton,Clinton County,-90.1887379,41.8444735
media/fsac/1a35333v.jpg,LC-DIG-fsac-1a35333,Alfred T. Palmer,"F.W. Hunter, Army test pilot, Douglas Aircraft Company plant at Long Beach, Calif.",1942,10,California,Long Beach,Los County,-118.1892348,33.7669623
media/fsac/1a34582v.jpg,LC-DIG-fsac-1a34582,Marjory Collins,"Garage mechanic near Newark, N.J. Badge denotes member of Office of Defense Transportation",1943,12,New Jersey,Newark,Essex County,-74.1723667,40.735657
media/fsac/1a34831v.jpg,LC-DIG-fsac-1a34831,Jack Delano,"Unloading a lake freighter at the Pennsylvania Railroad iron ore docks by means of Hulett unloaders, Cleveland, Ohio. In the foreground, empty cars are waiting to pass under the unloaders to pick up their loads",1943,5,Ohio,Cleveland,Cuyahoga County,-81.6954088,41.4994954
media/fsac/1a34134v.jpg,LC-DIG-fsac-1a34134,Russell Lee,"Rodeo at the Pie Town, New Mexico Fair",1940,10,New Mexico,Pie Town,Catron County,-108.1347836,34.2983884
media/fsac/1a33866v.jpg,LC-DIG-fsac-1a33866,Jack Delano,"Near the waterfront, New Bedford, Mass.",1941,1,Massachusetts,New Bedford,Bristol County,-70.934205,41.6362152
media/fsac/1a34945v.jpg,LC-DIG-fsac-1a34945,Howard R. Hollem,"Putting the nose section of a mighty transport plane in place in the fuselage mating fixture at the Consolidated Aircraft Corporation plant, Fort Worth, Texas",1942,10,Texas,Fort Worth,Tarrant County,-97.3208496,32.725409
media/fsac/1a34786v.jpg,LC-DIG-fsac-1a34786,Jack Delano,"General view of part of the South Water Street freight depot of the Illinois Central Railroad, Chicago, Ill.",1943,5,Illinois,Chicago,Cook County,-87.6500523,41.850033
media/fsac/1a34618v.jpg,LC-DIG-fsac-1a34618,Jack Delano,"Working on a locomotive at the 40th Street shop of the C &amp; NW RR, Chicago, Ill.",1942,12,Illinois,Chicago,Cook County,-87.6500523,41.850033
media/fsac/1a34347v.jpg,LC-DIG-fsac-1a34347,Marion Post Wolcott,"Day laborers picking cotton near Clarksdale, Miss.",1939,11,Mississippi,Clarksdale,Coahoma County,-90.5709323,34.2001086
media/fsac/1a34246v.jpg,LC-DIG-fsac-1a34246,Arthur Rothstein,"Instructor explaining the operation of the parachute to students, Meacham Field, Fort Worth, Tex.",1942,1,Texas,Fort Worth,Tarrant County,-97.3208496,32.725409
media/fsac/1a34621v.jpg,LC-DIG-fsac-1a34621,Jack Delano,"A Chicago and Northwestern railroad roundhouse, Chicago, Ill.",1942,12,Illinois,Melrose Park,Cook County,-87.8567277,41.9005865
media/fsac/1a33865v.jpg,LC-DIG-fsac-1a33865,Jack Delano,"Skating, vicinity of Brockton, Mass.",1940,12,Massachusetts,Brockton,Plymouth County,-71.0183787,42.0834335
media/fsac/1a34679v.jpg,LC-DIG-fsac-1a34679,Jack Delano,"General view of one of the classification yards of the C &amp; NW RR., Chicago, Ill.",1942,12,Illinois,Melrose Park,Cook County,-87.8567277,41.9005865
media/fsac/1a35219v.jpg,LC-DIG-fsac-1a35219,Alfred T. Palmer,"M-3 tanks in action, Ft. Knox, Ky.",1942,6,Kentucky,Fort Knox,Hardin County,-85.963629,37.891129
media/fsac/1a34633v.jpg,LC-DIG-fsac-1a34633,Jack Delano,"Painting a car at the repair or &quot;rip&quot; tracks at North Proviso(?), C &amp; NW RR., Chicago, Ill.",1942,12,Illinois,Melrose Park,Cook County,-87.8567277,41.9005865
media/fsac/1a34381v.jpg,LC-DIG-fsac-1a34381,Marion Post Wolcott,"Mountaineers and farmers trading mules and horses on &quot;Jockey St.,&quot; near the Court House, Campton, Wolfe County, Ky.",1940,9,Kentucky,Campton,Wolfe County,-83.547409,37.7342526
media/fsac/1a34933v.jpg,LC-DIG-fsac-1a34933,Howard R. Hollem,"Drilling a wing bulkhead for a transport plane at the Consolidated Aircraft Corporation plant, Fort Worth, Texas",1942,10,Texas,Fort Worth,Tarrant County,-97.3208496,32.725409
media/fsac/1a34775v.jpg,LC-DIG-fsac-1a34775,Jack Delano,"Diesel switch engineer moving freight cars at the South Water street freight terminal of the Illinois Central R.R., Chicago, Ill. The N.Y. Central is one of the railroads that lease terminal facilities from the I.C.R.R.",1943,4,Illinois,Chicago,Cook County,-87.6500523,41.850033
media/fsac/1a34903v.jpg,LC-DIG-fsac-1a34903,Howard R. Hollem,"Aviation cadets in training at the Naval Air Base, Corpus Christi, Texas",1942,8,Texas,Corpus Christi,Nueces County,-97.396381,27.8005828
media/fsac/1a33871v.jpg,LC-DIG-fsac-1a33871,Jack Delano,"Men and a woman reading headlines posted in street-corner window of Brockton Enterprise newspaper office on Christmas Eve, Brockton, Mass.",1940,12,Massachusetts,Brockton,Plymouth County,-71.0183787,42.0834335
media/fsac/1a34645v.jpg,LC-DIG-fsac-1a34645,Jack Delano,"Locomotives over the ash pit at the roundhouse and coaling station at the Chicago and Northwestern Railroad yards, Chicago, Ill.",1942,12,Illinois,Chicago,Cook County,-87.6500523,41.850033
media/fsac/1a33843v.jpg,LC-DIG-fsac-1a33843,Jack Delano,"Farm in the vicinity of Van Buren, Aroostook County, Me.",1940,10,Maine,Van Buren,Aroostook County,-67.9353018,47.1572653
media/fsac/1a34980v.jpg,LC-DIG-fsac-1a34980,Howard R. Hollem,"Helen Ryan, age 41 (with cap), widow and used to work in a show factory, Heil and Co., Milwaukee, Wisconsin. Agnes Cliemka, age 23, married and husband may be going into the service any day, brother in the army. [She] used to be a clerk in a dep[artmen]t store. Unmasking and checking parts of the gasoline trailers that will be turned over to the Air Force",1943,2,Wisconsin,Milwaukee,Milwaukee County,-87.9064736,43.0389025
media/fsac/1a35035v.jpg,LC-DIG-fsac-1a35035,Russell Lee,"Scrap and salvage depot, Butte, Mont.",1942,10,Montana,Butte,Silver County,-112.5347447,46.0038153
media/fsac/1a34236v.jpg,LC-DIG-fsac-1a34236,Russell Lee,"Shasta dam under construction, California",1942,6,California,Redding,Shasta County,-122.3916754,40.5865396
media/fsac/1a34614v.jpg,LC-DIG-fsac-1a34614,Jack Delano,"Locomotive lubrication chart in the laboratory of the Chicago and Northwestern Railroad. The laboratory assistant in foreground is working at a precision balance. Chicago, Ill",1942,12,Illinois,Chicago,Cook County,-87.6500523,41.850033
media/fsac/1a34747v.jpg,LC-DIG-fsac-1a34747,Jack Delano,"Westbound freight train stopping for water, Melrose, N[ew] Mex[ico]",1943,3,New Mexico,Melrose,Curry County,-103.63246,34.4303525
media/fsac/1a34117v.jpg,LC-DIG-fsac-1a34117,Russell Lee,"Mrs. Norris with homegrown cabbage, one of the many vegetables which the homesteaders grow in abundance, Pie Town, New Mexico",1940,10,New Mexico,Pie Town,Catron County,-108.1347836,34.2983884
media/fsac/1a35398v.jpg,LC-DIG-fsac-1a35398,Mark Sherwood,"North American&#39;s P-51 Mustang Fighter is in service with Britain&#39;s Royal Air Force, N[orth] A[merican] Aviation, Inc., Inglewood, Calif.",1942,10,California,Inglewood,Los County,-118.3531311,33.9616801
media/fsac/1a35086v.jpg,LC-DIG-fsac-1a35086,Alfred T. Palmer,"Man of the Fort Story, Va. coastal defense",1942,3,Virginia,Fort Story,City News,-76.5840675,37.1587672
media/fsac/1a34739v.jpg,LC-DIG-fsac-1a34739,Jack Delano,"Santa Fe R.R. near Melrose, New Mexico",1943,3,New Mexico,Melrose,Curry County,-103.63246,34.4303525
media/fsac/1a35275v.jpg,LC-DIG-fsac-1a35275,Alfred T. Palmer,"TVA chemical plant, electric furnace loaded with phosphate, vicinity of Muscle Shoals, Alabama",1942,6,Alabama,Muscle Shoals,Colbert County,-87.6675292,34.7448112
media/fsac/1a34877v.jpg,LC-DIG-fsac-1a34877,Howard R. Hollem,"With a woman&#39;s determination, Lorena Craig takes over a man-size job, Corpus Christi, Texas. Before she came to work at the Naval air base she was a department store girl. Now she is a cowler under civil service",1942,8,Texas,Corpus Christi,Nueces County,-97.396381,27.8005828
media/fsac/1a34876v.jpg,LC-DIG-fsac-1a34876,Howard R. Hollem,"Jesse Rhodes Waller, A.O.M., third class, tries out a 30-calibre machine gun he has just installed on a Navy plane, Naval Air Base, Corpus Christi, Texas",1942,8,Texas,Corpus Christi,Nueces County,-97.396381,27.8005828
media/fsac/1a35280v.jpg,LC-DIG-fsac-1a35280,Alfred T. Palmer,"Large electric phosphate smelting furnace used in the making of elemental phosphorus in a TVA chemical plant in the Muscle Shoals area, Alabama",1942,6,Alabama,Muscle Shoals,Colbert County,-87.6675292,34.7448112
media/fsac/1a34710v.jpg,LC-DIG-fsac-1a34710,Jack Delano,"Santa Fe R.R. locomotive shops, Topeka, Kansas",1943,3,Kansas,Topeka,Shawnee County,-95.6780371,39.0483336
media/fsac/1a34774v.jpg,LC-DIG-fsac-1a34774,Jack Delano,"Loading oranges into a refrigerator car at a co-op orange packing plant, Redlands, Calif. Santa Fe R.R. trip",1943,3,California,Redlands,San County,-117.1825381,34.0555693
media/fsac/1a35217v.jpg,LC-DIG-fsac-1a35217,Alfred T. Palmer,"Tank driver, Ft. Knox, Ky.",1942,6,Kentucky,Fort Knox,Hardin County,-85.963629,37.891129
media/fsac/1a35414v.jpg,LC-DIG-fsac-1a35414,Arthur Siegel,"Hanna furnaces of the Great Lakes Steel Corporation, Detroit, Mich. Cleaning out loose coke after removing a door preparatory to putting door back",1942,11,Michigan,Detroit,Wayne County,-83.0457538,42.331427
media/fsac/1a34216v.jpg,LC-DIG-fsac-1a34216,Russell Lee,"Milk and butter fat receiving depot and creamery, Caldwell, Idaho",1941,7,Idaho,Caldwell,Canyon County,-116.6873596,43.6629384
media/fsac/1a34584v.jpg,LC-DIG-fsac-1a34584,Marjory Collins,"Camouflage class in New York University, where men and women are preparing for jobs in the Army or in industry, New York, N.Y. They make models from aerial photographs, re-photograph them, then work out a camouflage scheme and make a final photograph",1943,3,New York,New York,New County,-74.0059729,40.7142691
media/fsac/1a35200v.jpg,LC-DIG-fsac-1a35200,Alfred T. Palmer,"The crew of an M-3 tank learn all the ways of causing trouble for the Axis with a 75-mm. gun, a 37-mm. gun and four machine guns, Fort Knox, Ky. The Fort Knox School for tank crews has graduated many men who are now ready to meet the enemy on our far flung battle lines -- and on more than equal terms. [Tank] commander",1942,6,Kentucky,Fort Knox,Hardin County,-85.963629,37.891129
media/fsac/1a34123v.jpg,LC-DIG-fsac-1a34123,Russell Lee,"Fruit wagon at the Pie Town, New Mexico Fair",1940,10,New Mexico,Pie Town,Catron County,-108.1347836,34.2983884
media/fsac/1a34097v.jpg,LC-DIG-fsac-1a34097,Russell Lee,"Home of Jim Norris, homesteader, Pie Town, New Mexico",1940,10,New Mexico,Pie Town,Catron County,-108.1347836,34.2983884
media/fsac/1a35313v.jpg,LC-DIG-fsac-1a35313,Alfred T. Palmer,"A nose wheel and landing gear assembly for a B-25 bomber under construction in a western aircraft plant, North American Aviation, Inc., Calif. A front section of the plane shows in the background. General Doolittle has called the ship the best military plane in existence. With plenty of speed, a 1,700-mile cruising range and a ceiling of 25,000 feet, it has performed brilliantly as a medium bomber and as an escort plane.",1942,10,California,Inglewood,Los County,-118.3531311,33.9616801
media/fsac/1a33850v.jpg,LC-DIG-fsac-1a33850,Jack Delano,"Factory buildings in Lowell, Mass.",1940,12,Massachusetts,Lowell,Middlesex County,-71.3161718,42.6334247
media/fsac/1a34155v.jpg,LC-DIG-fsac-1a34155,Russell Lee,"Llano de San Juan, New Mexico, Catholic Church",1940,10,New Mexico,Llano,Taos County,-105.681682,36.1400257
media/fsac/1a34351v.jpg,LC-DIG-fsac-1a34351,Marion Post Wolcott,"Day laborers picking cotton near Clarksdale, Miss.",1939,11,Mississippi,Clarksdale,Coahoma County,-90.5709323,34.2001086
media/fsac/1a35006v.jpg,LC-DIG-fsac-1a35006,Fenno Jacobs,"Children stage a patriotic demonstration, Southington, Conn.",1942,5,Connecticut,Southington,Hartford County,-72.8776013,41.5964869
media/fsac/1a34881v.jpg,LC-DIG-fsac-1a34881,Howard R. Hollem,"Cadet L. Deitz at the Naval Air Base, Corpus Christi, Texas",1942,8,Texas,Corpus Christi,Nueces County,-97.396381,27.8005828
media/fsac/1a34456v.jpg,LC-DIG-fsac-1a34456,David Bransby,"Woman aircraft worker, Vega Aircraft Corporation, Burbank, Calif. Shown checking electrical assemblies",1942,6,California,Burbank,Los County,-118.3089661,34.1808392
media/fsac/1a34794v.jpg,LC-DIG-fsac-1a34794,Jack Delano,"John Kelseh, blacksmith, at his forge in the blacksmith shop at the roundhouse, Rock Island R.R., Blue Island, Ill.",1943,4,Illinois,Blue Island,Cook County,-87.6800486,41.6572562
media/fsac/1a34806v.jpg,LC-DIG-fsac-1a34806,Jack Delano,"C. &amp; N.W. R.R., women wipers at the roundhouse cleaning one of the giant &quot;H&#39; class locomotives, Clinton, Iowa",1943,4,Iowa,Clinton,Clinton County,-90.1887379,41.8444735
media/fsac/1a34922v.jpg,LC-DIG-fsac-1a34922,Howard R. Hollem,"Starting a propeller at the Naval Air Base, Corpus Christi, Texas",1942,8,Texas,Corpus Christi,Nueces County,-97.396381,27.8005828
media/fsac/1a34388v.jpg,LC-DIG-fsac-1a34388,Marion Post Wolcott,"Mountaineers and farmers trading mules and horses on &quot;Jockey St.,&quot; near the Court House, [Campton], Wolfe County, Ky.",1940,9,Kentucky,Campton,Wolfe County,-83.547409,37.7342526
media/fsac/1a34875v.jpg,LC-DIG-fsac-1a34875,Howard R. Hollem,"Formerly a sociology major at the University of Southern California, Mrs. Eloise J. Ellis (right) now &quot;keeps &#39;em flyin&#39;&quot; at the Naval Air Base, Corpus Christi, Texas. She is a supervisor under civil service in the Assembly and Repair Department. It is her job to maintain morale among the women by helping them solve housing and other personal problems. With her is Jo Ann Whittington, an NYA trainee at the plant",1942,8,Texas,Corpus Christi,Nueces County,-97.396381,27.8005828
media/fsac/1a34159v.jpg,LC-DIG-fsac-1a34159,Russell Lee,"Llano de San Juan, New Mexico, Catholic Church",1940,10,New Mexico,Llano,Taos County,-105.681682,36.1400257
